<?xml version="1.0" encoding="UTF-8"?>

<!-- Dateiname: firma-ns.dtd -->
	
	<!-- FIRMA -->
	<!ELEMENT soft:firma (soft:team+, soft:projekt*)>
	<!ATTLIST soft:firma 
   				xmlns:soft CDATA #REQUIRED
				xmlns:xsi CDATA #REQUIRED
				xsi:noNamespaceSchemaLocation CDATA #REQUIRED
				name NMTOKEN #REQUIRED
   				nummer ID #FIXED 'e0604411'			
	> 
   
   	<!-- TEAM -->
	<!ELEMENT soft:team (soft:mitarbeiter, soft:mitarbeiter, soft:mitarbeiter*)>
	<!ATTLIST soft:team 
   				id ID #REQUIRED
	>
   	
	<!-- MITARBEITER -->
	<!ELEMENT soft:mitarbeiter (#PCDATA)>
	<!ATTLIST soft:mitarbeiter 
   				position (leiter | mitglied) 'mitglied'
	>
   
   
   	<!-- PROJEKT -->
	<!ELEMENT soft:projekt (soft:name, soft:beschreibung?)>
	<!ATTLIST soft:projekt 
   				team IDREF #REQUIRED
   				arbeitsstunden NMTOKEN #IMPLIED
	>
	
	<!-- SONSTIGE ELEMENTE -->
	<!ELEMENT soft:beschreibung (#PCDATA | soft:schlagwort)*>
	<!ELEMENT soft:name (#PCDATA)>
	<!ELEMENT soft:schlagwort (#PCDATA)>
	

